id,channel,title,url,published,views,duration,baseline,multiple,views_per_day,vpd_multiple
RygikaUoRU4,Primal Space,How The US Magically Creates Money,https://www.youtube.com/watch?v=RygikaUoRU4,2025-01-28,1834752,584,3017468,0.61,3397.7,0.42
5BDnDiX-ZHk,Primal Space,NASA's Big Metal Balls,https://www.youtube.com/watch?v=5BDnDiX-ZHk,2023-10-28,1241092,539,3017468,0.41,1243.6,0.15
tJ97-5AACBw,Primal Space,The Only Antarctic Crash With Survivors,https://www.youtube.com/watch?v=tJ97-5AACBw,2024-08-27,1193767,677,3017468,0.40,1720.1,0.21
qiJMdfj9NmI,Primal Space,The Space Shuttle’s Luckiest Escape,https://www.youtube.com/watch?v=qiJMdfj9NmI,2024-05-24,1060025,490,3017468,0.35,1343.5,0.17
CsyQa8_9tlw,Primal Space,How The CIA Hacked Russia,https://www.youtube.com/watch?v=CsyQa8_9tlw,2026-06-30,972629,566,3017468,0.32,44210.4,5.45
P0BUbWXvySE,Primal Space,The Escape of Europe’s Smartest Criminal,https://www.youtube.com/watch?v=P0BUbWXvySE,2026-05-29,740723,816,3017468,0.25,13717.1,1.69
KTIOl4oMRuA,Primal Space,The Crazy Engineering of Silk,https://www.youtube.com/watch?v=KTIOl4oMRuA,2026-02-20,697229,545,3017468,0.23,4587.0,0.57
rCGQRonkEHs,Primal Space,How Ford Built a Car Every 40 Seconds,https://www.youtube.com/watch?v=rCGQRonkEHs,2026-04-30,438091,867,3017468,0.15,5278.2,0.65
1zjcnnx7igc,Real Engineering,The Insane Engineering of the F-117 Nighthawk,https://www.youtube.com/watch?v=1zjcnnx7igc,2024-06-08,5634553,1657,1877866,3.00,7279.8,1.23
LklUVkMPl8g,Real Engineering,The Problem with Wind Energy,https://www.youtube.com/watch?v=LklUVkMPl8g,2024-06-29,4879976,1007,1877866,2.60,6480.7,1.09
w4FCkbPykdQ,Real Engineering,How The Space Shuttle Worked | Full Documentary,https://www.youtube.com/watch?v=w4FCkbPykdQ,2024-12-14,4614589,4670,1877866,2.46,7888.2,1.33
geIhl_VE0IA,Real Engineering,NASA'S Plutonium Problem,https://www.youtube.com/watch?v=geIhl_VE0IA,2025-03-22,4040684,1283,1877866,2.15,8297.1,1.40
R2tgByRCLzM,Real Engineering,The Insane Engineering of the F-14 Tomcat,https://www.youtube.com/watch?v=R2tgByRCLzM,2024-12-06,3608313,1755,1877866,1.92,6084.8,1.03
Gb4UBK53sGQ,Real Engineering,The Insane Engineering of the P-38 Lightning,https://www.youtube.com/watch?v=Gb4UBK53sGQ,2025-06-28,3266559,1604,1877866,1.74,8397.3,1.42
4BmRrbxQCos,Real Engineering,The V-22 Osprey and why it keeps crashing,https://www.youtube.com/watch?v=4BmRrbxQCos,2025-02-01,3141009,1442,1877866,1.67,5860.1,0.99
b_EoZzE7KJ0,Real Engineering,Geothermal Energy is Changing | Quaise Energy Documentary,https://www.youtube.com/watch?v=b_EoZzE7KJ0,2025-03-01,3041066,1314,1877866,1.62,5986.4,1.01
Dsk0aIRrHb4,Real Engineering,The Problems with China's Space Program,https://www.youtube.com/watch?v=Dsk0aIRrHb4,2024-10-05,2938650,1006,1877866,1.56,4486.5,0.76
nyG8XAmtYeQ,Real Engineering,Why Airport Security Suddenly Got Better,https://www.youtube.com/watch?v=nyG8XAmtYeQ,2024-04-23,2300405,787,1877866,1.23,2805.4,0.47
IC32zBGdJok,Real Engineering,Why the US is Struggling to Land on the Moon,https://www.youtube.com/watch?v=IC32zBGdJok,2024-11-25,2268911,1195,1877866,1.21,3756.5,0.63
z_PlyQAWT4g,Real Engineering,How the Boeing 787 Works | Full Documentary,https://www.youtube.com/watch?v=z_PlyQAWT4g,2025-05-31,2241771,3931,1877866,1.19,5375.9,0.91
EVwlTsa9oMM,Real Engineering,Earth to Mars in 10 Days,https://www.youtube.com/watch?v=EVwlTsa9oMM,2025-09-20,2162263,1580,1877866,1.15,7089.4,1.20
jiWtrVL4tmA,Real Engineering,China’s Plan to Block All Submarines,https://www.youtube.com/watch?v=jiWtrVL4tmA,2025-04-19,2005986,1254,1877866,1.07,4370.3,0.74
h3sbDTl2MSU,Real Engineering,How Will the Golden Dome Work?,https://www.youtube.com/watch?v=h3sbDTl2MSU,2025-07-12,1936626,1378,1877866,1.03,5164.3,0.87
I1ixCSAc3bc,Real Engineering,The Worst Oil Disaster Ever,https://www.youtube.com/watch?v=I1ixCSAc3bc,2024-05-06,1819107,1037,1877866,0.97,2254.2,0.38
8VLovd9bS5U,Real Engineering,The Age of Laser Warfare Has Begun,https://www.youtube.com/watch?v=8VLovd9bS5U,2025-10-25,1790848,1400,1877866,0.95,6632.8,1.12
n7Q1vubN4w8,Real Engineering,Why America’s Tank Failed in Ukraine,https://www.youtube.com/watch?v=n7Q1vubN4w8,2026-02-21,1409642,1371,1877866,0.75,9335.4,1.58
j0ZZfIz9R1I,Real Engineering,How We Built The ISS,https://www.youtube.com/watch?v=j0ZZfIz9R1I,2025-12-06,1412467,2165,1877866,0.75,6195.0,1.05
SzKkBOUvsAY,Real Engineering,The Insane Engineering of Europa Clipper,https://www.youtube.com/watch?v=SzKkBOUvsAY,2024-10-13,1404361,1257,1877866,0.75,2170.6,0.37
PB_8dGKh9JI,Real Engineering,How Apple AirPods Work,https://www.youtube.com/watch?v=PB_8dGKh9JI,2025-08-16,1308591,1092,1877866,0.70,3848.8,0.65
tCDY1k1JGqw,Real Engineering,How Firefly is Revolutionizing the Logistics of Spaceflight | Full Documentary,https://www.youtube.com/watch?v=tCDY1k1JGqw,2024-08-07,1160123,2921,1877866,0.62,1624.8,0.27
FYMdllTCrc0,Real Engineering,The Insane Engineering of the V-22 Osprey,https://www.youtube.com/watch?v=FYMdllTCrc0,2026-04-25,1031106,1388,1877866,0.55,11717.1,1.98
8jQzwxS8vxA,Real Engineering,The Unlikely Rise of the Indian Space Program,https://www.youtube.com/watch?v=8jQzwxS8vxA,2025-05-17,995629,1729,1877866,0.53,2310.0,0.39
wKP6tYA6ds4,Real Engineering,How NASA Discovered a Military Base under Greenland,https://www.youtube.com/watch?v=wKP6tYA6ds4,2026-03-21,961617,1302,1877866,0.51,7818.0,1.32
QsYYNk-EeJA,Real Engineering,The Wildest Take-Off of My Life,https://www.youtube.com/watch?v=QsYYNk-EeJA,2024-09-07,799678,1743,1877866,0.43,1170.8,0.20
SMJMYyszflM,Real Engineering,How We Built the ISS - Part 2,https://www.youtube.com/watch?v=SMJMYyszflM,2025-12-20,624536,1704,1877866,0.33,2918.4,0.49
ZewlcJsfbn8,Real Engineering,The Dark Side of the World’s Lightest Structural Metal,https://www.youtube.com/watch?v=ZewlcJsfbn8,2026-06-06,499773,908,1877866,0.27,10864.6,1.83
Vf_pS0XSTyo,Real Engineering,Solar Farms in Space - Reflect Orbital,https://www.youtube.com/watch?v=Vf_pS0XSTyo,2025-12-03,513858,1878,1877866,0.27,2224.5,0.38
_qpdUNMt2yg,Real Engineering,The Space Data Centers Situation is Insane,https://www.youtube.com/watch?v=_qpdUNMt2yg,2026-06-27,482777,1261,1877866,0.26,19311.1,3.26
r_RnzEDln8w,RealLifeLore,What's Hidden Under the Jungles of New Guinea?,https://www.youtube.com/watch?v=r_RnzEDln8w,2025-12-24,2202865,2540,856991,2.57,10489.8,1.32
Kp4eLkofznA,RealLifeLore,How The Iran War is Becoming a World War,https://www.youtube.com/watch?v=Kp4eLkofznA,2026-03-18,2062056,2090,856991,2.41,16365.5,2.07
T8y7ZIq4jXY,RealLifeLore,Why Russia is Suddenly Losing in Ukraine,https://www.youtube.com/watch?v=T8y7ZIq4jXY,2026-06-12,1973451,1565,856991,2.30,49336.3,6.23
iMVGVJFyggY,RealLifeLore,The Worst Horror On Earth You Aren't Being Told About,https://www.youtube.com/watch?v=iMVGVJFyggY,2025-11-28,1971803,2796,856991,2.30,8355.1,1.05
QjhqB3tC1Ko,RealLifeLore,Crimea Situation Is Insane,https://www.youtube.com/watch?v=QjhqB3tC1Ko,2026-07-09,1794686,1288,856991,2.09,138052.8,17.42
-QoNbWhZClM,RealLifeLore,The Dumbest Decision in American History,https://www.youtube.com/watch?v=-QoNbWhZClM,2026-04-08,1684403,1905,856991,1.97,16041.9,2.02
QOUBqb1jHsA,RealLifeLore,How Japan is Preparing for War With China,https://www.youtube.com/watch?v=QOUBqb1jHsA,2025-12-12,1663872,2973,856991,1.94,7494.9,0.95
n8kSGH4I8Ps,RealLifeLore,Why the Iranian Regime is Failing,https://www.youtube.com/watch?v=n8kSGH4I8Ps,2025-11-11,1610479,2345,856991,1.88,6365.5,0.80
qZXpB0lHmd8,RealLifeLore,The Middle East's Next War After Iran,https://www.youtube.com/watch?v=qZXpB0lHmd8,2026-03-13,1494549,2172,856991,1.74,11408.8,1.44
c3C9gxWwzTg,RealLifeLore,Why Cuba is the Fastest Dying Country on Earth,https://www.youtube.com/watch?v=c3C9gxWwzTg,2026-02-20,1454421,3400,856991,1.70,9568.6,1.21
VkYWW95eSLs,RealLifeLore,A European Ice Age is Coming Sooner Than We Thought...,https://www.youtube.com/watch?v=VkYWW95eSLs,2026-05-29,1157782,1451,856991,1.35,21440.4,2.71
LwdSfdEkXPA,RealLifeLore,Why Israel is Trying to Conquer 10% of Lebanon,https://www.youtube.com/watch?v=LwdSfdEkXPA,2026-04-15,938436,1633,856991,1.10,9575.9,1.21
2o4IUPNYAK0,RealLifeLore,How Iran Will Kill 80+ Years of US Global Hegemony,https://www.youtube.com/watch?v=2o4IUPNYAK0,2026-04-24,936418,1804,856991,1.09,10521.6,1.33
TBHryws39sc,RealLifeLore,The Nightmare Geography Glitch Hiding in New Hampshire,https://www.youtube.com/watch?v=TBHryws39sc,2026-02-26,935238,1384,856991,1.09,6405.7,0.81
z-qp5Z7F4XQ,RealLifeLore,Why NOTHING About Maduro's Kidnapping Makes Sense,https://www.youtube.com/watch?v=z-qp5Z7F4XQ,2026-01-24,873089,2759,856991,1.02,4877.6,0.62
eX0WfHpKmqY,RealLifeLore,"Why 400,000 People Live in Earth's Coldest City",https://www.youtube.com/watch?v=eX0WfHpKmqY,2026-03-27,840894,1708,856991,0.98,7187.1,0.91
jq0FhcfAbG0,RealLifeLore,Why Utah’s Great Salt Lake is Dying,https://www.youtube.com/watch?v=jq0FhcfAbG0,2025-10-17,829859,1806,856991,0.97,2985.1,0.38
O3dSjY4j7Ak,RealLifeLore,Why Life in Louisiana has Become Impossible,https://www.youtube.com/watch?v=O3dSjY4j7Ak,2026-05-22,812808,2438,856991,0.95,13324.7,1.68
pGKyL7YPnSQ,RealLifeLore,"Why 90% of Japan is ""Empty""",https://www.youtube.com/watch?v=pGKyL7YPnSQ,2025-11-19,704266,1427,856991,0.82,2874.6,0.36
V14RCK_QiG0,RealLifeLore,The Incredible Logistics Behind the World's Longest Flight,https://www.youtube.com/watch?v=V14RCK_QiG0,2026-06-19,634564,1636,856991,0.74,19229.2,2.43
RACRUkkdJgQ,RealLifeLore,Why The Worst Border Gore on Earth Exists,https://www.youtube.com/watch?v=RACRUkkdJgQ,2025-12-19,603023,1982,856991,0.70,2804.8,0.35
A-2bCKakP7c,RealLifeLore,Why The 2-State Solution Has Become Impossible Now,https://www.youtube.com/watch?v=A-2bCKakP7c,2025-10-31,579612,2372,856991,0.68,2195.5,0.28
UCpEozv3pRY,RealLifeLore,The Making of the Modern Middle East,https://www.youtube.com/watch?v=UCpEozv3pRY,2026-04-01,531973,16168,856991,0.62,4749.8,0.60
IgD7zmJN3_A,RealLifeLore,How The UAE Just Got Wrecked In Yemen,https://www.youtube.com/watch?v=IgD7zmJN3_A,2026-01-14,509289,1921,856991,0.59,2694.7,0.34
Km2A-9DwzeM,RealLifeLore,Why Britain Pays So Much to Defend the Falklands,https://www.youtube.com/watch?v=Km2A-9DwzeM,2026-05-16,485429,3190,856991,0.57,7245.2,0.91
e8RFxahD7hQ,RealLifeLore,What a US Invasion of Greenland Would Actually Look Like,https://www.youtube.com/watch?v=e8RFxahD7hQ,2026-01-30,446065,2458,856991,0.52,2578.4,0.33
5iy1qcy6XkY,RealLifeLore,Why Spain Still Controls Cities Hidden in Africa,https://www.youtube.com/watch?v=5iy1qcy6XkY,2026-02-18,419989,1973,856991,0.49,2727.2,0.34
nEBcD6sFDpY,RealLifeLore,Caspian Sea Situation Is Insane,https://www.youtube.com/watch?v=nEBcD6sFDpY,2026-06-30,378563,1153,856991,0.44,17207.4,2.17
To8rpgqvtSc,RealLifeLore,What's Hidden Under the World's Most Mysterious Places?,https://www.youtube.com/watch?v=To8rpgqvtSc,2026-04-30,307582,8843,856991,0.36,3705.8,0.47
ZPu3kezlC08,RealLifeLore,The Hormuz Situation Keeps Getting More Insane,https://www.youtube.com/watch?v=ZPu3kezlC08,2026-07-22,21073,1843,856991,0.02,21073.0,2.66
piH4O4doAMo,Sabin Civil Engineering,The CRUEL Physics behind Tsunamis!,https://www.youtube.com/watch?v=piH4O4doAMo,2025-05-30,7230776,724,1098305,6.58,17298.5,6.63
5l4I-caLoxY,Sabin Civil Engineering,The MAGIC behind Da Vinci’s Self Supporting Bridge!,https://www.youtube.com/watch?v=5l4I-caLoxY,2024-10-31,6715772,362,1098305,6.11,10676.9,4.09
DOgnE6JQqso,Sabin Civil Engineering,How are Modern Flyovers Built?,https://www.youtube.com/watch?v=DOgnE6JQqso,2025-02-22,5781911,1028,1098305,5.26,11227.0,4.31
pFAXxUGt0r0,Sabin Civil Engineering,Channel Tunnel | The Mind-blowing Engineering Behind It,https://www.youtube.com/watch?v=pFAXxUGt0r0,2025-08-30,5521740,1091,1098305,5.03,16937.9,6.50
MNH0k4gz1Nk,Sabin Civil Engineering,Crushing Pressure: The Mysteries of Mariana Trench,https://www.youtube.com/watch?v=MNH0k4gz1Nk,2025-12-19,3080826,894,1098305,2.81,14329.4,5.50
k06c8LduVog,Sabin Civil Engineering,Vajont Dam : The Deadliest Dam Tragedy in Human History,https://www.youtube.com/watch?v=k06c8LduVog,2024-12-02,2573492,735,1098305,2.34,4310.7,1.65
KMvCWFCoVN4,Sabin Civil Engineering,Collapse of Building 7 | The Complete Physics,https://www.youtube.com/watch?v=KMvCWFCoVN4,2024-07-13,2303115,690,1098305,2.10,3116.5,1.20
5PYjFLMoxOg,Sabin Civil Engineering,How India Built the World’s Highest Railway Bridge Over a Himalayan Abyss,https://www.youtube.com/watch?v=5PYjFLMoxOg,2025-02-01,2070229,710,1098305,1.88,3862.4,1.48
4ilbmf3OXBM,Sabin Civil Engineering,Statue of Liberty : Even Today's Engineers are Surprised!,https://www.youtube.com/watch?v=4ilbmf3OXBM,2024-08-30,1989724,969,1098305,1.81,2879.5,1.10
Naypd790jCY,Sabin Civil Engineering,How are Bridges Built over the Ocean?,https://www.youtube.com/watch?v=Naypd790jCY,2025-06-13,1640188,1271,1098305,1.49,4059.9,1.56
RoA_p_Wr84Y,Sabin Civil Engineering,Leaning Tower of Pisa | The Incredible Physics behind its Lean,https://www.youtube.com/watch?v=RoA_p_Wr84Y,2026-01-28,1523402,908,1098305,1.39,8705.2,3.34
lqNluizQ3oE,Sabin Civil Engineering,Three Gorges: How 40 Billion Tons of Water Shifted the Earth’s Axis,https://www.youtube.com/watch?v=lqNluizQ3oE,2026-03-20,1510185,1670,1098305,1.38,12178.9,4.67
m-Haf79ygQY,Sabin Civil Engineering,The Collapse of WTC | Solving All the Mysteries,https://www.youtube.com/watch?v=m-Haf79ygQY,2024-07-16,1371819,609,1098305,1.25,1863.9,0.71
JHuf1Hu7ApU,Sabin Civil Engineering,The Beauty of Reinforced Concrete!,https://www.youtube.com/watch?v=JHuf1Hu7ApU,2024-12-31,1168968,391,1098305,1.06,2058.0,0.79
ohzbJht-o9o,Sabin Civil Engineering,Immersed Tube Tunnels | Genius Engineering Under the Waves,https://www.youtube.com/watch?v=ohzbJht-o9o,2025-10-09,1094266,725,1098305,1.00,3826.1,1.47
Ns9vOYnK-70,Sabin Civil Engineering,The GENIUS Engineering Behind Bailey Bridges!,https://www.youtube.com/watch?v=Ns9vOYnK-70,2025-07-11,1102345,652,1098305,1.00,2931.8,1.12
_GoQmBhdr98,Sabin Civil Engineering,Silver Bridge | The Tragedy That Changed Civil Engineering Forever,https://www.youtube.com/watch?v=_GoQmBhdr98,2025-04-03,1090409,626,1098305,0.99,2295.6,0.88
TfpBWgSOfWg,Sabin Civil Engineering,"The Biggest Mystery of Physics, How did Engineers Solve it?",https://www.youtube.com/watch?v=TfpBWgSOfWg,2025-09-30,689091,474,1098305,0.63,2335.9,0.90
T_vwDeY28R8,Sabin Civil Engineering,The Hidden Engineering of Interchanges!,https://www.youtube.com/watch?v=T_vwDeY28R8,2025-08-15,631726,908,1098305,0.58,1852.6,0.71
HIgZWlR2ngI,Sabin Civil Engineering,Mystery SOLVED - How did they Walk the Moai statues?,https://www.youtube.com/watch?v=HIgZWlR2ngI,2025-07-03,605706,654,1098305,0.55,1577.4,0.60
8jaa_6J91go,Sabin Civil Engineering,Sinkhole Physics : Why the Earth Swallows Itself?,https://www.youtube.com/watch?v=8jaa_6J91go,2025-11-06,586230,542,1098305,0.53,2272.2,0.87
tOjYeqvTfJM,Sabin Civil Engineering,How did they Lift a 4400 Ton Steel Spire to the Top of Burj Khalifa?,https://www.youtube.com/watch?v=tOjYeqvTfJM,2025-03-12,522130,958,1098305,0.48,1050.6,0.40
UKiiiCEU8fw,Sabin Civil Engineering,How does a Gas Nozzle KNOW when to shut off?,https://www.youtube.com/watch?v=UKiiiCEU8fw,2024-05-08,528888,621,1098305,0.48,657.0,0.25
gj00yIRDatY,Sabin Civil Engineering,Inside the Impossible Kansai Airport – Japan’s $20B Floating Mega Project,https://www.youtube.com/watch?v=gj00yIRDatY,2026-01-07,295189,982,1098305,0.27,1506.1,0.58
TvjY0ihchYs,Sabin Civil Engineering,Europe Will be Transformed Completely After this Tunnel | Fehmarnbelt,https://www.youtube.com/watch?v=TvjY0ihchYs,2026-05-30,104632,1212,1098305,0.10,1974.2,0.76
m4joDZLtI84,Sabin Civil Engineering,Drilling into the Mantle | Soviet Engineering at its Peak,https://www.youtube.com/watch?v=m4joDZLtI84,2026-07-02,99213,1392,1098305,0.09,4960.6,1.90
LkrjYgcr5n4,Sabin Civil Engineering,Strange Phenomenon Inside the Dam | The Deadliest Dam Collapse,https://www.youtube.com/watch?v=LkrjYgcr5n4,2026-04-30,96109,1249,1098305,0.09,1157.9,0.44
I8spvx01nOY,Sabin Civil Engineering,Understanding Zero Tolerance Machining through this Cute Cube!,https://www.youtube.com/watch?v=I8spvx01nOY,2024-10-02,87494,188,1098305,0.08,133.0,0.05
9ZY5kVo7GA8,Sabin Civil Engineering,Our New Course | PLC Based Industrial Automation,https://www.youtube.com/watch?v=9ZY5kVo7GA8,2026-06-19,20280,288,1098305,0.02,614.5,0.24
1UzlVPhvEco,Sabin Civil Engineering,This Bridge Disappared in Seconds : Sunshine Skyway Disaster,https://www.youtube.com/watch?v=1UzlVPhvEco,2026-05-29,25010,938,1098305,0.02,463.1,0.18
00BHXAzYRTA,The B1M,How the World’s Most Remote Megaproject Went Wrong,https://www.youtube.com/watch?v=00BHXAzYRTA,2026-03-25,2522888,903,976749,2.58,21200.7,1.42
Ho2luOd8JH4,The B1M,Norway is Building The World's Deepest Mega-Tunnel,https://www.youtube.com/watch?v=Ho2luOd8JH4,2026-06-03,1968529,1770,976749,2.02,40174.1,2.69
Vr_Wd2ZucZA,The B1M,Why Nobody Wants the Chrysler Building,https://www.youtube.com/watch?v=Vr_Wd2ZucZA,2026-05-06,1722533,1279,976749,1.76,22370.6,1.50
D-Oa2vEr8Rs,The B1M,The Biggest Train Station in the World is Now Open,https://www.youtube.com/watch?v=D-Oa2vEr8Rs,2026-04-22,1658338,1174,976749,1.70,18223.5,1.22
WICVlQOb09o,The B1M,Why Maglev is (Basically) Impossible,https://www.youtube.com/watch?v=WICVlQOb09o,2026-04-15,1509668,1093,976749,1.55,15404.8,1.03
6R31yvR8f7E,The B1M,Vietnam’s $67BN Gamble on High-Speed Rail,https://www.youtube.com/watch?v=6R31yvR8f7E,2026-04-08,1449050,1003,976749,1.48,13800.5,0.93
vVfEs9wrW98,The B1M,Why the Jeddah Tower Won't Be One Kilometre Tall,https://www.youtube.com/watch?v=vVfEs9wrW98,2026-04-29,1380876,1048,976749,1.41,16439.0,1.10
T_Jz9xzOoO4,The B1M,Ireland's $27BN Plan to (Finally) Catch Up With Europe,https://www.youtube.com/watch?v=T_Jz9xzOoO4,2026-03-04,1323697,1107,976749,1.36,9455.0,0.63
bzTntRHmpa8,The B1M,Switzerland’s $2BN Tunnel U-Turn,https://www.youtube.com/watch?v=bzTntRHmpa8,2026-03-18,1239400,1025,976749,1.27,9836.5,0.66
VdWQQ1OCUPo,The B1M,The €7BN Mega-Canal That Will Reshape Europe,https://www.youtube.com/watch?v=VdWQQ1OCUPo,2026-06-15,1164516,920,976749,1.19,31473.4,2.11
TT1WO8zWk7o,The B1M,LA’s ‘No-Car’ Olympics Plan Explained,https://www.youtube.com/watch?v=TT1WO8zWk7o,2026-04-13,1122672,1136,976749,1.15,11226.7,0.75
gnND5qkf0Xs,The B1M,Egypt is Building a New Nile,https://www.youtube.com/watch?v=gnND5qkf0Xs,2026-06-24,1087161,920,976749,1.11,38827.2,2.60
GPh5xtXWwT8,The B1M,The $12.5BN Airport That Will Overhaul World Travel,https://www.youtube.com/watch?v=GPh5xtXWwT8,2026-07-08,1070186,959,976749,1.10,76441.9,5.13
Um2Y01tdj7s,The B1M,The Sphere Failed. Why Are They Building More?,https://www.youtube.com/watch?v=Um2Y01tdj7s,2026-06-29,1042028,992,976749,1.07,45305.6,3.04
A0lQPphWTkQ,The B1M,The US Megaproject You’ve (Probably) Never Heard Of,https://www.youtube.com/watch?v=A0lQPphWTkQ,2026-04-27,1016138,1095,976749,1.04,11815.6,0.79
d-LArPe1Rk0,The B1M,Inside Europe’s Abandoned $9BN Airport,https://www.youtube.com/watch?v=d-LArPe1Rk0,2026-05-18,937360,1278,976749,0.96,14420.9,0.97
sLEnn-sgpIk,The B1M,Powering The Internet is Becoming a Big Problem,https://www.youtube.com/watch?v=sLEnn-sgpIk,2026-04-20,785076,1003,976749,0.80,8441.7,0.57
Fe6hX-wPRjY,The B1M,The Real Reason US High-Speed Rail Failed,https://www.youtube.com/watch?v=Fe6hX-wPRjY,2026-04-01,762083,1154,976749,0.78,6804.3,0.46
gSy487RneZA,The B1M,Why Dubai's New Giant Faces a Race Against Time,https://www.youtube.com/watch?v=gSy487RneZA,2026-06-01,727721,1004,976749,0.75,14269.0,0.96
EEa1gV2Ud_M,The B1M,The Bridge Collapse That Shocked a Nation,https://www.youtube.com/watch?v=EEa1gV2Ud_M,2026-03-11,731158,1066,976749,0.75,5497.4,0.37
jwDDihSijzk,The B1M,Have We Finally Built Too Thin?,https://www.youtube.com/watch?v=jwDDihSijzk,2026-07-15,693278,992,976749,0.71,99039.7,6.64
7VMiargwCyg,The B1M,The $70BN Plan to Fix Toronto,https://www.youtube.com/watch?v=7VMiargwCyg,2026-05-20,688101,1187,976749,0.70,10922.2,0.73
VV-C2EGfocE,The B1M,New York’s Insane $119BN Mega Sea Wall,https://www.youtube.com/watch?v=VV-C2EGfocE,2026-06-22,658319,897,976749,0.67,21944.0,1.47
Tmte0qRKF1A,The B1M,The Abandoned Megastructure Saved by a Tech Giant,https://www.youtube.com/watch?v=Tmte0qRKF1A,2026-05-27,611404,1114,976749,0.63,10917.9,0.73
-eJcCpoXx50,The B1M,The Skyscraper Boom No One is Talking About,https://www.youtube.com/watch?v=-eJcCpoXx50,2026-07-01,583576,1088,976749,0.60,27789.3,1.86
dqo_KAEF81k,The B1M,Why Canada Got it Right With its New SkyTrain,https://www.youtube.com/watch?v=dqo_KAEF81k,2026-06-17,575253,1068,976749,0.59,16435.8,1.10
0CWb9CVPShM,The B1M,Dubai Has a $22 Billion Plumbing Problem,https://www.youtube.com/watch?v=0CWb9CVPShM,2026-05-13,539579,938,976749,0.55,7708.3,0.52
6_v4hBVjqvo,The B1M,The Race to Save Hagia Sophia,https://www.youtube.com/watch?v=6_v4hBVjqvo,2026-06-10,474636,1177,976749,0.49,11300.9,0.76
uTCA6RZmQbY,The B1M,This Country is Dominating The Nuclear Power Race,https://www.youtube.com/watch?v=uTCA6RZmQbY,2026-07-22,45928,988,976749,0.05,45928.0,3.08
aBa5lmM5gLY,The B1M,What's Causing The World’s BIGGEST Construction Boom?,https://www.youtube.com/watch?v=aBa5lmM5gLY,2026-04-20,45227,181,976749,0.05,486.3,0.03
DW4rItB20h4,The Efficient Engineer,Understanding Bernoulli's Equation,https://www.youtube.com/watch?v=DW4rItB20h4,2020-10-06,4429523,824,939109,4.72,2094.3,2.12
XLzTB4KLCxU,The Efficient Engineer,The Incredible Strength of Bolted Joints,https://www.youtube.com/watch?v=XLzTB4KLCxU,2023-04-18,4352550,1078,939109,4.63,3654.5,3.69
GHjopp47vvQ,The Efficient Engineer,Understanding the Finite Element Method,https://www.youtube.com/watch?v=GHjopp47vvQ,2021-04-27,2243261,1116,939109,2.39,1173.3,1.19
G7wnGeR_69k,The Efficient Engineer,Understanding GD&T,https://www.youtube.com/watch?v=G7wnGeR_69k,2023-01-18,2236609,1772,939109,2.38,1746.0,1.76
ht9GwXQMgpo,The Efficient Engineer,Understanding Engineering Drawings,https://www.youtube.com/watch?v=ht9GwXQMgpo,2022-10-11,2010151,1354,939109,2.14,1456.6,1.47
E3i_XHlVCeU,The Efficient Engineer,Understanding Aerodynamic Lift,https://www.youtube.com/watch?v=E3i_XHlVCeU,2021-02-09,1973323,859,939109,2.10,992.1,1.00
PaGJwOPg2kU,The Efficient Engineer,Understanding Metals,https://www.youtube.com/watch?v=PaGJwOPg2kU,2021-06-08,1925933,1078,939109,2.05,1029.9,1.04
KHJmQdvnfPE,The Efficient Engineer,The Problem with Stainless Steel,https://www.youtube.com/watch?v=KHJmQdvnfPE,2026-02-10,1774234,1233,939109,1.89,10952.1,11.07
VvDJyhYSJv8,The Efficient Engineer,Understanding Viscosity,https://www.youtube.com/watch?v=VvDJyhYSJv8,2021-03-09,1760355,775,939109,1.87,897.7,0.91
vLaFAKnaRJU,The Efficient Engineer,Understanding Vibration and Resonance,https://www.youtube.com/watch?v=vLaFAKnaRJU,2021-10-12,1721753,1182,939109,1.83,987.2,1.00
JnYVz1TSmBQ,The Efficient Engineer,"How Levers, Pulleys and Gears Work",https://www.youtube.com/watch?v=JnYVz1TSmBQ,2022-07-26,1605680,953,939109,1.71,1102.0,1.11
9A-uUG0WR0w,The Efficient Engineer,Understanding Laminar and Turbulent Flow,https://www.youtube.com/watch?v=9A-uUG0WR0w,2020-09-08,1302105,899,939109,1.39,607.6,0.61
MvBqCeZllpQ,The Efficient Engineer,Understanding the Deflection of Beams,https://www.youtube.com/watch?v=MvBqCeZllpQ,2020-11-03,1229287,1335,939109,1.31,589.0,0.60
GMmNKUlXXDs,The Efficient Engineer,Understanding Aerodynamic Drag,https://www.youtube.com/watch?v=GMmNKUlXXDs,2021-01-12,1210349,1003,939109,1.29,600.1,0.61
21G7LA2DcGQ,The Efficient Engineer,Understanding Buckling,https://www.youtube.com/watch?v=21G7LA2DcGQ,2021-08-17,1129531,889,939109,1.20,627.5,0.63
5voQfQOTem8,The Efficient Engineer,How to Build a Satellite,https://www.youtube.com/watch?v=5voQfQOTem8,2024-05-21,748687,1627,939109,0.80,945.3,0.96
C9oWXIs2g3Y,The Efficient Engineer,Understanding Calculus (for engineers),https://www.youtube.com/watch?v=C9oWXIs2g3Y,2025-11-18,645443,2046,939109,0.69,2623.8,2.65
VRBpqM6ESrg,The Efficient Engineer,Understanding Steels and Heat Treatment,https://www.youtube.com/watch?v=VRBpqM6ESrg,2025-10-07,613497,1475,939109,0.65,2130.2,2.15
04K0bLwCDdM,The Efficient Engineer,The Incredible Properties of Composite Materials,https://www.youtube.com/watch?v=04K0bLwCDdM,2023-09-12,555304,1416,939109,0.59,531.9,0.54
wbXbj20351o,The Efficient Engineer,The Problem with Titanium,https://www.youtube.com/watch?v=wbXbj20351o,2026-04-07,536147,1416,939109,0.57,5058.0,5.11
SP2hy3Uf0Ls,The Efficient Engineer,Understanding Momentum,https://www.youtube.com/watch?v=SP2hy3Uf0Ls,2024-11-26,484287,1177,939109,0.52,803.1,0.81
FDmYCI_xYlA,The Efficient Engineer,Understanding Thermal Radiation,https://www.youtube.com/watch?v=FDmYCI_xYlA,2021-11-30,448618,1053,939109,0.48,264.7,0.27
6jQsLAqrZGQ,The Efficient Engineer,Understanding Conduction and the Heat Equation,https://www.youtube.com/watch?v=6jQsLAqrZGQ,2022-04-05,381848,1101,939109,0.41,243.4,0.25
mx7NYrUXDB0,The Efficient Engineer,Understanding Friction,https://www.youtube.com/watch?v=mx7NYrUXDB0,2025-08-26,350086,1144,939109,0.37,1060.9,1.07
p_0duihxmW4,The Efficient Engineer,The Problem with Welding,https://www.youtube.com/watch?v=p_0duihxmW4,2026-05-19,331231,1297,939109,0.35,5175.5,5.23
CRa9djnZRu0,The Efficient Engineer,The Ingenious Design of Strain Gauges,https://www.youtube.com/watch?v=CRa9djnZRu0,2024-02-20,306866,1180,939109,0.33,347.5,0.35
uaWfZTLNPmA,The Efficient Engineer,Understanding Pressure Vessels,https://www.youtube.com/watch?v=uaWfZTLNPmA,2025-07-08,242233,675,939109,0.26,639.1,0.65
RB9mZbtcock,The Efficient Engineer,The Insane Properties of Superalloys,https://www.youtube.com/watch?v=RB9mZbtcock,2025-05-27,237279,796,939109,0.25,563.6,0.57
bycVtx07f0w,The Efficient Engineer,The Surprising Science of Plastics,https://www.youtube.com/watch?v=bycVtx07f0w,2025-04-08,212500,1557,939109,0.23,452.1,0.46
