id,channel,title,url,published,views,duration,baseline,multiple,views_per_day,vpd_multiple
tqhtkG6glug,Mustard,The Soviet Airliner Designed To Crash,https://www.youtube.com/watch?v=tqhtkG6glug,2022-11-17,7834929,830,6891617,1.14,5833.9,0.94
dByvPIyIbZE,Mustard,What Happened To Flying Wings?,https://www.youtube.com/watch?v=dByvPIyIbZE,2022-08-27,7445727,811,6891617,1.08,5225.1,0.84
FM-OOo4Sw-o,Mustard,What Went Wrong With Germany's Insane Hover Transport?,https://www.youtube.com/watch?v=FM-OOo4Sw-o,2020-04-25,6956074,576,6891617,1.01,3052.2,0.49
IjCylxs8hZU,Mustard,Soviet Flying Aircraft Carriers Were Ingenious,https://www.youtube.com/watch?v=IjCylxs8hZU,2023-09-10,6907289,807,6891617,1.00,6603.5,1.06
sFBvPue70l8,Mustard,Why You Couldn’t Afford To Fly Concorde,https://www.youtube.com/watch?v=sFBvPue70l8,2020-07-18,6875946,822,6891617,1.00,3132.5,0.50
unz6mfjS4ws,Mustard,A Plane Without Wings: The Coléoptère,https://www.youtube.com/watch?v=unz6mfjS4ws,2020-12-21,6185210,500,6891617,0.90,3033.5,0.49
-f906Sy79hA,Mustard,What Really Happened To Giant Flying Boats?,https://www.youtube.com/watch?v=-f906Sy79hA,2020-02-14,6015195,672,6891617,0.87,2559.7,0.41
bEgAgJc8Heg,Mustard,Why French Trains Are The Fastest,https://www.youtube.com/watch?v=bEgAgJc8Heg,2023-07-02,5796135,957,6891617,0.84,5193.7,0.84
E2i3EeUnku0,Mustard,Navy Flying Ships Were Insane,https://www.youtube.com/watch?v=E2i3EeUnku0,2023-01-25,5715327,733,6891617,0.83,4486.1,0.72
cYj4F_cyiJI,Mustard,Why Was This Ship Banned From Ports?,https://www.youtube.com/watch?v=cYj4F_cyiJI,2022-01-21,4725765,815,6891617,0.69,2876.3,0.46
kG8zlZNnZlE,Mustard,The Sinking No One Could Explain,https://www.youtube.com/watch?v=kG8zlZNnZlE,2025-05-22,4718268,1065,6891617,0.68,11075.7,1.78
w6vgVTJK_rg,Mustard,Navy Airships Were Insane,https://www.youtube.com/watch?v=w6vgVTJK_rg,2025-01-26,3917501,1230,6891617,0.57,7227.9,1.16
twwDv7jjjfw,Mustard,The World's Largest Plane Wasn't What You Think,https://www.youtube.com/watch?v=twwDv7jjjfw,2021-02-25,3954082,593,6891617,0.57,2004.1,0.32
uYn6fyGNg7c,Mustard,It Seemed Like a Good Idea,https://www.youtube.com/watch?v=uYn6fyGNg7c,2020-10-30,3832134,507,6891617,0.56,1832.7,0.29
j6ttTK8x8ZA,Mustard,America’s Nightmare: The 47mph Monster,https://www.youtube.com/watch?v=j6ttTK8x8ZA,2026-01-17,3332468,839,6891617,0.48,17916.5,2.88
5RtwFbSeV5Y,Mustard,When a MiG-25 fought an F-15,https://www.youtube.com/watch?v=5RtwFbSeV5Y,2025-08-16,3231309,866,6891617,0.47,9503.9,1.53
yOApFeEgHcE,Mustard,This Insane Helicopter Was The Largest Ever Built:  The Mil V-12 Story,https://www.youtube.com/watch?v=yOApFeEgHcE,2020-09-10,2974034,542,6891617,0.43,1389.1,0.22
GJ-4uWwQ5HA,Mustard,Inflatable Airplanes Were A Bad Idea,https://www.youtube.com/watch?v=GJ-4uWwQ5HA,2021-03-26,2356472,510,6891617,0.34,1212.2,0.19
YCD1j4L7j3s,Mustard,This Jet Changed Everything,https://www.youtube.com/watch?v=YCD1j4L7j3s,2026-06-05,1832735,895,6891617,0.27,38994.4,6.27
WrX2QVJ2c3Q,Neo,How the CIA Found Osama bin Laden,https://www.youtube.com/watch?v=WrX2QVJ2c3Q,2023-01-16,15667642,969,5517003,2.84,12211.7,1.43
BwziJOvqFE0,Neo,How the U.S. Found Saddam Hussein,https://www.youtube.com/watch?v=BwziJOvqFE0,2025-04-14,15065086,1276,5517003,2.73,32467.9,3.80
3epU697sU9E,Neo,Inside Air Force One During 9/11,https://www.youtube.com/watch?v=3epU697sU9E,2024-06-04,14402468,1138,5517003,2.61,18512.2,2.16
88vmzn_LufA,Neo,How the US President Travels,https://www.youtube.com/watch?v=88vmzn_LufA,2023-12-06,14134923,641,5517003,2.56,14739.2,1.72
4YuNvIfM-YA,Neo,The Densest City on Earth,https://www.youtube.com/watch?v=4YuNvIfM-YA,2023-07-24,12760934,1069,5517003,2.31,11664.5,1.36
VbeM8Lf7s5A,Neo,The Genius Design of Apple Park,https://www.youtube.com/watch?v=VbeM8Lf7s5A,2023-02-06,12272469,1092,5517003,2.22,9724.6,1.14
aqKGJgZyiHw,Neo,How the World Trade Center Was Rebuilt,https://www.youtube.com/watch?v=aqKGJgZyiHw,2022-09-06,11255225,1710,5517003,2.04,7954.2,0.93
-mzqQ_vNiKg,Neo,The Incredible Thai Cave Rescue,https://www.youtube.com/watch?v=-mzqQ_vNiKg,2023-04-05,11112239,1410,5517003,2.01,9229.4,1.08
mIiPt1YVkP8,Neo,The Worst Crash That Never Happened,https://www.youtube.com/watch?v=mIiPt1YVkP8,2023-05-08,9769584,1305,5517003,1.77,8342.9,0.98
KoJ0Pih0Ssc,Neo,How the Berlin Wall Worked,https://www.youtube.com/watch?v=KoJ0Pih0Ssc,2024-04-09,9115652,732,5517003,1.65,10930.0,1.28
JGiXuXc3cao,Neo,How the Titanic Was Found,https://www.youtube.com/watch?v=JGiXuXc3cao,2024-07-08,8807248,1339,5517003,1.60,11837.7,1.38
qqXtPNDCuVk,Neo,What the Apollo 11 Site Looks Like Today,https://www.youtube.com/watch?v=qqXtPNDCuVk,2022-12-12,7555755,572,5517003,1.37,5732.7,0.67
2dAp1PmhH8g,Neo,The Battle for Las Vegas,https://www.youtube.com/watch?v=2dAp1PmhH8g,2023-03-07,6818378,1077,5517003,1.24,5529.9,0.65
EpqarCB9UD8,Neo,How Minecraft Was Made,https://www.youtube.com/watch?v=EpqarCB9UD8,2025-01-10,5967490,1323,5517003,1.08,10694.4,1.25
xo9p8p6deRI,Neo,The Incredible O.J. Simpson Chase,https://www.youtube.com/watch?v=xo9p8p6deRI,2024-05-06,5788973,1142,5517003,1.05,7173.4,0.84
-lyyIvxy2Z4,Neo,The Deepwater Horizon Disaster,https://www.youtube.com/watch?v=-lyyIvxy2Z4,2025-05-12,5245034,1414,5517003,0.95,12029.9,1.41
7r0CHuqRkI8,Neo,Why This Japanese Island is Abandoned,https://www.youtube.com/watch?v=7r0CHuqRkI8,2025-03-11,4682239,1105,5517003,0.85,9402.1,1.10
oRt5NPY7yYA,Neo,How Nukes Are Transported,https://www.youtube.com/watch?v=oRt5NPY7yYA,2024-01-21,3235854,590,5517003,0.59,3544.2,0.41
6wJ52H0aq9Q,Neo,The Unbelievable Chile Mine Rescue,https://www.youtube.com/watch?v=6wJ52H0aq9Q,2025-02-11,3104159,2037,5517003,0.56,5901.4,0.69
HGQzlpu2I-I,Neo,Why China Is Building Ships in the Desert,https://www.youtube.com/watch?v=HGQzlpu2I-I,2025-07-14,2759340,924,5517003,0.50,7397.7,0.87
vlUUrrwcUQw,Neo,How Pit Stops Are So Fast,https://www.youtube.com/watch?v=vlUUrrwcUQw,2025-06-16,2484036,529,5517003,0.45,6194.6,0.72
5Nkad_6aigM,Neo,The Impossible Landing,https://www.youtube.com/watch?v=5Nkad_6aigM,2026-02-24,2241539,1639,5517003,0.41,15145.5,1.77
CvUIQuAlsWw,Neo,Why Kuwait Is Building This Strange City,https://www.youtube.com/watch?v=CvUIQuAlsWw,2022-05-09,2188383,904,5517003,0.40,1425.7,0.17
iFbDHtQN3Bs,Neo,The Most Controversial Place America Owns,https://www.youtube.com/watch?v=iFbDHtQN3Bs,2025-11-18,2155177,2139,5517003,0.39,8760.9,1.02
a8AuaeqeM3s,Neo,How Airspace Closures Work,https://www.youtube.com/watch?v=a8AuaeqeM3s,2022-04-01,1660812,930,5517003,0.30,1055.8,0.12
T4b57E7oHYc,Neo,The Biggest Art Scam in History,https://www.youtube.com/watch?v=T4b57E7oHYc,2025-09-16,1494209,1277,5517003,0.27,4835.6,0.57
zjLOXG0NMEE,Neo,The Never Ending Race to Build High,https://www.youtube.com/watch?v=zjLOXG0NMEE,2022-06-07,1241171,919,5517003,0.22,824.2,0.10
krSePO1QsDI,Neo,Inside the U.S. Doomsday Plane,https://www.youtube.com/watch?v=krSePO1QsDI,2026-07-13,815684,919,5517003,0.15,90631.6,10.60
4S_5w5ptiK0,Neo,Why Gaddafi Hated Switzerland,https://www.youtube.com/watch?v=4S_5w5ptiK0,2026-04-14,805886,1600,5517003,0.15,8140.3,0.95
L0Le8bT1RLE,Neo,Why Saudi Arabia Is Building a Floating City,https://www.youtube.com/watch?v=L0Le8bT1RLE,2022-07-01,560701,602,5517003,0.10,378.3,0.04
GvkvS0fPQCI,Plainly Difficult,The Worlds Only Capital City with a Population of 0: The Montserrat Disaster,https://www.youtube.com/watch?v=GvkvS0fPQCI,2026-05-23,334785,664,200784,1.67,5579.8,2.46
MRKHSGyTQo8,Plainly Difficult,A $100 Million Dollar Corner Cut: The Tropicana Car Park Collapse,https://www.youtube.com/watch?v=MRKHSGyTQo8,2026-04-11,306515,700,200784,1.53,3005.0,1.32
Qo3UMWvz7ko,Plainly Difficult,Concrete and Steel Architecture School Collapses In Busy University Camus | The Delft Disaster,https://www.youtube.com/watch?v=Qo3UMWvz7ko,2026-01-31,282581,695,200784,1.41,1642.9,0.72
JL8Oew3yoUM,Plainly Difficult,Full Speed Crash: The Grayrigg High Speed Train Disaster,https://www.youtube.com/watch?v=JL8Oew3yoUM,2026-06-06,272964,993,200784,1.36,5934.0,2.62
aKNMJyQWKnI,Plainly Difficult,It Wouldn't Stop Shaking: The SEG Plaza Incident,https://www.youtube.com/watch?v=aKNMJyQWKnI,2026-05-05,268578,482,200784,1.34,3443.3,1.52
_xfEn452Mf8,Plainly Difficult,Supermarket Tunnel Collapse Onto Busy Commuter Railway: The Gerrards Cross Tunnel Collapse,https://www.youtube.com/watch?v=_xfEn452Mf8,2026-03-14,265320,788,200784,1.32,2040.9,0.90
AY_Ksz8Rnms,Plainly Difficult,Train Crashes Into Ticket office: The Chester Train Accident,https://www.youtube.com/watch?v=AY_Ksz8Rnms,2026-01-24,246462,820,200784,1.23,1376.9,0.61
BfHPvBjYLr4,Plainly Difficult,21 Killed in Seconds: The Alcântara VLS Disaster,https://www.youtube.com/watch?v=BfHPvBjYLr4,2026-03-21,227483,678,200784,1.13,1849.5,0.82
7cVcmWJahW0,Plainly Difficult,No-one Could Stop It: The Taichung Metro Train Crane Crash,https://www.youtube.com/watch?v=7cVcmWJahW0,2026-02-21,227712,829,200784,1.13,1508.0,0.66
WaL67tZJVQI,Plainly Difficult,Social Media Train Crash: The Kirkby Train Disaster,https://www.youtube.com/watch?v=WaL67tZJVQI,2026-04-18,216900,915,200784,1.08,2283.2,1.01
SqnfoLXlFuY,Plainly Difficult,Concrete And Steel Tower Collapses In Busy City Centre | Plainly Difficult,https://www.youtube.com/watch?v=SqnfoLXlFuY,2026-02-28,211682,785,200784,1.05,1470.0,0.65
c2NHWJXUaz0,Plainly Difficult,One of The Worlds Tallest Structures Collapsed In Seconds: The Warsaw Radio Mast Disaster,https://www.youtube.com/watch?v=c2NHWJXUaz0,2026-01-10,209521,654,200784,1.04,1085.6,0.48
qf2KQjJxuE4,Plainly Difficult,Doomed: The State Audit Office High Rise Tower Collapse,https://www.youtube.com/watch?v=qf2KQjJxuE4,2026-05-30,206832,816,200784,1.03,3902.5,1.72
xldynLEsltQ,Plainly Difficult,28 Students Killed In Seconds: The Yuba City School Bus Disaster,https://www.youtube.com/watch?v=xldynLEsltQ,2026-01-17,207215,751,200784,1.03,1114.1,0.49
YmJ0zej8CXE,Plainly Difficult,Fatal Design Error Kills 4: The Charles De Gaulle Airport Disaster,https://www.youtube.com/watch?v=YmJ0zej8CXE,2026-07-11,203317,727,200784,1.01,18483.4,8.15
j06PlISZMlE,Plainly Difficult,Massive Sinkhole Appears Under Worlds Busiest Airport: The Heathrow Tunnel Disaster,https://www.youtube.com/watch?v=j06PlISZMlE,2026-04-25,198252,1130,200784,0.99,2252.9,0.99
4rQcZZFNnTA,Plainly Difficult,Doomed: The I-95 Bridge Collapse That Happened In minutes,https://www.youtube.com/watch?v=4rQcZZFNnTA,2026-05-09,186126,725,200784,0.93,2515.2,1.11
ZYP0q_krCMc,Plainly Difficult,Lightning Strike Blows Up Mine: The Sago Mine Tragedy,https://www.youtube.com/watch?v=ZYP0q_krCMc,2026-02-14,182187,886,200784,0.91,1153.1,0.51
kTNzFLqqHI0,Plainly Difficult,When Penny Pinching Backfires | The Pipers Row Lift Slab Concrete Car Park Collapse,https://www.youtube.com/watch?v=kTNzFLqqHI0,2026-05-16,181352,638,200784,0.90,2706.7,1.19
OoFTeTd_nXY,Plainly Difficult,Cement Truck Falls off of Bridge and Crushes Commuter Train Crash | Plainly Difficult ,https://www.youtube.com/watch?v=OoFTeTd_nXY,2026-06-20,179663,723,200784,0.89,5614.5,2.48
gDQpVTCheH0,Plainly Difficult,They Couldn't Stop It: The Lisbon Funicular Train Disaster 2025,https://www.youtube.com/watch?v=gDQpVTCheH0,2026-03-28,172294,723,200784,0.86,1485.3,0.65
-yPPgTxIh5k,Plainly Difficult,Train Carrying Fuel Explodes in Middle of A City: The Viareggio Disaster ,https://www.youtube.com/watch?v=-yPPgTxIh5k,2026-04-04,152622,705,200784,0.76,1400.2,0.62
UiYr_upV3EQ,Plainly Difficult,Train Driver Misses Signal and Travels Wrong Way Down London Track | Plainly Difficult,https://www.youtube.com/watch?v=UiYr_upV3EQ,2026-07-04,141540,875,200784,0.70,7863.3,3.47
cwDCxAhYHSQ,Plainly Difficult,Passengers Thrown from their Seats Mid Ride: The Jetline Rollercoaster Tragedy 2023,https://www.youtube.com/watch?v=cwDCxAhYHSQ,2026-02-07,118231,797,200784,0.59,716.6,0.32
x5hUw2vfwio,Plainly Difficult,No Fire Controls and Left To Burn: The Apex  North Carolina Chemical Disaster | Plainly Difficult,https://www.youtube.com/watch?v=x5hUw2vfwio,2026-06-13,115171,744,200784,0.57,2953.1,1.30
aqeEdRmQTKo,Plainly Difficult,Instant Collapse: When the MV Dali Toppled the Francis Scott Key Bridge,https://www.youtube.com/watch?v=aqeEdRmQTKo,2026-03-11,112354,1222,200784,0.56,844.8,0.37
ZYs7e9GEtX0,Plainly Difficult,The Bizarre SPERT Nuclear Reactor Meltdown Test | Plainly Difficult Radiation Documentary  ,https://www.youtube.com/watch?v=ZYs7e9GEtX0,2026-06-27,101961,685,200784,0.51,4078.4,1.80
QLacJMmIYV4,Plainly Difficult,How a Minor Fault Led to A Fatal Error: The Flight 8501 Airbus Tragedy 2014,https://www.youtube.com/watch?v=QLacJMmIYV4,2026-05-02,96839,958,200784,0.48,1195.5,0.53
5jCwB7mhRLU,Plainly Difficult,A Bad Day: The Paris Montparnasse Train Disaster | Plainly Difficult,https://www.youtube.com/watch?v=5jCwB7mhRLU,2026-07-18,73477,921,200784,0.37,18369.2,8.10
P442G78mVrw,Plainly Difficult,The Dark Side of Science: The Bizarre Blue Eyes/ Brown Eyes Experiment,https://www.youtube.com/watch?v=P442G78mVrw,2026-06-30,59819,1188,200784,0.30,2719.0,1.20
CXfNGcMSwzU,PolyMatter,Russia is Running Out of People,https://www.youtube.com/watch?v=CXfNGcMSwzU,2024-07-06,961496,1067,340169,2.83,1288.9,1.29
A5Phoh0eRUc,PolyMatter,The College Enrollment Crisis,https://www.youtube.com/watch?v=A5Phoh0eRUc,2025-01-11,949817,1046,340169,2.79,1705.2,1.71
KuWAdYl5icY,PolyMatter,Why There Are No Flights Between India and China,https://www.youtube.com/watch?v=KuWAdYl5icY,2024-09-07,906541,1170,340169,2.66,1327.3,1.33
Di5rmpD03iM,PolyMatter,What Xi Jinping Fears More than America,https://www.youtube.com/watch?v=Di5rmpD03iM,2024-11-15,740559,1276,340169,2.18,1206.1,1.21
HlHKC844le8,PolyMatter,America’s Birth Rate “Crisis”,https://www.youtube.com/watch?v=HlHKC844le8,2024-09-28,592945,1744,340169,1.74,895.7,0.90
uaKN006y0tI,PolyMatter,How China Killed Hong Kong's Economy,https://www.youtube.com/watch?v=uaKN006y0tI,2025-02-21,586002,1142,340169,1.72,1135.7,1.14
OceYCEexDqQ,PolyMatter,The Surprising Way Credit Cards Make Money,https://www.youtube.com/watch?v=OceYCEexDqQ,2024-12-20,488926,1263,340169,1.44,844.4,0.85
bThPluSzlDU,PolyMatter,Why “Learn to Code” Failed,https://www.youtube.com/watch?v=bThPluSzlDU,2025-04-25,474317,1526,340169,1.39,1047.1,1.05
KXvVyd2wmdQ,PolyMatter,Why Singapore Elects the Losers of its Elections,https://www.youtube.com/watch?v=KXvVyd2wmdQ,2025-05-20,455026,1388,340169,1.34,1063.1,1.06
-JbIOGGTRTY,PolyMatter,Why Apple Can’t Leave China (yet),https://www.youtube.com/watch?v=-JbIOGGTRTY,2025-06-07,431588,1093,340169,1.27,1052.7,1.05
H5EF8v0iGBs,PolyMatter,Why China Banned Homework,https://www.youtube.com/watch?v=H5EF8v0iGBs,2024-06-16,396168,1281,340169,1.16,517.2,0.52
OzfJZYsc_sk,PolyMatter,Why Russia and Kazakhstan Pretend to be Allies,https://www.youtube.com/watch?v=OzfJZYsc_sk,2025-01-31,366211,1089,340169,1.08,682.0,0.68
uQTosk4xLT8,PolyMatter,China is Not a Socialist Utopia.,https://www.youtube.com/watch?v=uQTosk4xLT8,2026-04-17,364114,1012,340169,1.07,3792.9,3.80
t9PF8V132Y4,PolyMatter,Walmart’s New Plan to Defeat Amazon,https://www.youtube.com/watch?v=t9PF8V132Y4,2026-05-01,358074,1189,340169,1.05,4366.8,4.37
jO_Ho229wqw,PolyMatter,Are We in a Cold War with China?,https://www.youtube.com/watch?v=jO_Ho229wqw,2024-08-24,355278,1349,340169,1.04,509.7,0.51
GL-MPhghHRI,PolyMatter,How China Accidentally Created a Billion Dollar Scam Industry,https://www.youtube.com/watch?v=GL-MPhghHRI,2025-04-05,325060,1522,340169,0.96,687.2,0.69
kAIwWGhzgiw,PolyMatter,How America Became the World’s #1 Oil Producer,https://www.youtube.com/watch?v=kAIwWGhzgiw,2024-10-30,244384,1329,340169,0.72,387.9,0.39
np-6guCkH-I,PolyMatter,Why the Average Japanese Farmer is 70 Years Old,https://www.youtube.com/watch?v=np-6guCkH-I,2025-03-14,231089,1188,340169,0.68,466.8,0.47
PoQvXW9QAPg,PolyMatter,Why China Banned Weird Architecture,https://www.youtube.com/watch?v=PoQvXW9QAPg,2025-09-26,204328,854,340169,0.60,683.4,0.68
-Iqdm8jOzHU,PolyMatter,The Return of Nuclear Weapons,https://www.youtube.com/watch?v=-Iqdm8jOzHU,2024-11-29,192904,741,340169,0.57,321.5,0.32
Jz5L3X453Jw,PolyMatter,"How America’s 4,488 Banks Work",https://www.youtube.com/watch?v=Jz5L3X453Jw,2026-07-03,183789,964,340169,0.54,9673.1,9.68
-10LuhWGbVk,PolyMatter,Why the United States is Suing Apple,https://www.youtube.com/watch?v=-10LuhWGbVk,2024-07-28,184651,1152,340169,0.54,255.0,0.26
j2QEieIiiXg,PolyMatter,The Entry-Level Job Crisis,https://www.youtube.com/watch?v=j2QEieIiiXg,2026-06-12,167480,1180,340169,0.49,4187.0,4.19
vEH4yo7PqzM,PolyMatter,America’s Self-Inflicted Doctor Shortage,https://www.youtube.com/watch?v=vEH4yo7PqzM,2026-02-27,157053,1106,340169,0.46,1083.1,1.08
EZTWK5fjHnk,PolyMatter,Taiwan is Not Venezuela,https://www.youtube.com/watch?v=EZTWK5fjHnk,2026-02-06,157905,1285,340169,0.46,951.2,0.95
HznjX-i3sqQ,PolyMatter,The European Country Putin Stubbornly Refuses to Invade,https://www.youtube.com/watch?v=HznjX-i3sqQ,2025-12-19,147140,944,340169,0.43,684.4,0.68
tFjvMTtbGHw,PolyMatter,Why Puerto Rico’s Economy Doesn’t Work,https://www.youtube.com/watch?v=tFjvMTtbGHw,2026-03-21,139313,1014,340169,0.41,1132.6,1.13
E8e2sKgMbJA,PolyMatter,Why Nepal Just Overthrew its Government,https://www.youtube.com/watch?v=E8e2sKgMbJA,2025-11-28,135323,901,340169,0.40,573.4,0.57
GpflQtqkQZ0,PolyMatter,Are America’s Students Falling Behind?,https://www.youtube.com/watch?v=GpflQtqkQZ0,2026-01-23,121602,765,340169,0.36,675.6,0.68
Y2v6rAK6pZs,PolyMatter,Can Switzerland Stay Neutral?,https://www.youtube.com/watch?v=Y2v6rAK6pZs,2026-05-29,105974,1050,340169,0.31,1962.5,1.96
PhW2BjFQCZM,Practical Engineering,The Los Angeles Aqueduct is Wild,https://www.youtube.com/watch?v=PhW2BjFQCZM,2026-03-17,4720550,1379,1058572,4.46,37169.7,6.61
3nDdLiXS5wk,Practical Engineering,The Bizarre Bases of Antenna Towers,https://www.youtube.com/watch?v=3nDdLiXS5wk,2025-10-07,3764871,1088,1058572,3.56,13072.5,2.32
3YvwqMDDb3k,Practical Engineering,Why Roads Get Washboards,https://www.youtube.com/watch?v=3YvwqMDDb3k,2026-06-02,2648013,1074,1058572,2.50,52960.3,9.41
RZg1zOKm5wk,Practical Engineering,When Abandoned Mines Collapse,https://www.youtube.com/watch?v=RZg1zOKm5wk,2025-05-06,2630981,1053,1058572,2.49,5952.4,1.06
xPksDeGoh4E,Practical Engineering,Do Retention Ponds Actually Work?,https://www.youtube.com/watch?v=xPksDeGoh4E,2026-02-03,2326672,1063,1058572,2.20,13767.3,2.45
7OHCOFFUamQ,Practical Engineering,Recreating an Ancient Pump (with no moving parts),https://www.youtube.com/watch?v=7OHCOFFUamQ,2026-01-06,2257136,791,1058572,2.13,11457.5,2.04
jPJCYrxqyT8,Practical Engineering,The Most Implausible Tunneling Method,https://www.youtube.com/watch?v=jPJCYrxqyT8,2025-05-20,2239403,932,1058572,2.12,5232.2,0.93
7mdvEtmo1pM,Practical Engineering,The Hidden Engineering of Niagara Falls,https://www.youtube.com/watch?v=7mdvEtmo1pM,2025-10-21,1910119,943,1058572,1.80,6971.2,1.24
ZJqY1WLX4zA,Practical Engineering,The Hidden Engineering of Runways,https://www.youtube.com/watch?v=ZJqY1WLX4zA,2026-01-20,1820672,1120,1058572,1.72,9949.0,1.77
QOnQORqkHcM,Practical Engineering,California’s Tallest Bridge Has Nothing Underneath,https://www.youtube.com/watch?v=QOnQORqkHcM,2025-08-19,1748900,1027,1058572,1.65,5189.6,0.92
Ku_ockR2t44,Practical Engineering,The Mind-Blowing Flaw That Flooded New Orleans,https://www.youtube.com/watch?v=Ku_ockR2t44,2026-07-07,1616296,1474,1058572,1.53,107753.1,19.15
fudWbvE8ZKw,Practical Engineering,How Liquid Dampers in Skyscrapers Work,https://www.youtube.com/watch?v=fudWbvE8ZKw,2025-07-01,1333813,1150,1058572,1.26,3455.5,0.61
J7ieKmP96Hc,Practical Engineering,The Wild Story of the Teton Dam Failure,https://www.youtube.com/watch?v=J7ieKmP96Hc,2026-04-21,1164550,1163,1058572,1.10,12658.2,2.25
RnYdt4T76mk,Practical Engineering,Why are Smokestacks So Tall?,https://www.youtube.com/watch?v=RnYdt4T76mk,2025-06-03,1157653,1220,1058572,1.09,2796.3,0.50
_R0xPffklXQ,Practical Engineering,Why Are There No Short Arch Dams?,https://www.youtube.com/watch?v=_R0xPffklXQ,2025-08-05,1082427,1000,1058572,1.02,3083.8,0.55
-2HSFJOzQQ8,Practical Engineering,Hurricane vs. Tiny Houses,https://www.youtube.com/watch?v=-2HSFJOzQQ8,2025-12-02,1034718,1324,1058572,0.98,4460.0,0.79
lnYA0_AzhsM,Practical Engineering,Sawing a Dam in Half (on Purpose),https://www.youtube.com/watch?v=lnYA0_AzhsM,2025-12-16,992923,1231,1058572,0.94,4554.7,0.81
2nX7Y8ZwShg,Practical Engineering,The Weirdest Tool in Underwater Construction,https://www.youtube.com/watch?v=2nX7Y8ZwShg,2025-09-02,995741,1065,1058572,0.94,3082.8,0.55
fKuIJ_z2Y6A,Practical Engineering,The Physics Behind the Thumb Trick,https://www.youtube.com/watch?v=fKuIJ_z2Y6A,2026-05-05,973135,1063,1058572,0.92,12476.1,2.22
WhCNpX3s-D8,Practical Engineering,How Water Recycling Works,https://www.youtube.com/watch?v=WhCNpX3s-D8,2025-06-17,905329,1041,1058572,0.86,2263.3,0.40
nol0_4qxzb0,Practical Engineering,The Hidden Engineering of Floating Bridges,https://www.youtube.com/watch?v=nol0_4qxzb0,2025-07-15,858025,1056,1058572,0.81,2306.5,0.41
Ssw5bdx1HKw,Practical Engineering,So You Want to Build a Tunnel...,https://www.youtube.com/watch?v=Ssw5bdx1HKw,2026-02-17,821485,1242,1058572,0.78,5299.9,0.94
f2uad6LT9fo,Practical Engineering,Concrete's Greatest Weakness is Time,https://www.youtube.com/watch?v=f2uad6LT9fo,2025-11-04,795929,1024,1058572,0.75,3061.3,0.54
sq6ZOVbKQhY,Practical Engineering,The Hidden Engineering Behind the Falkirk Wheel,https://www.youtube.com/watch?v=sq6ZOVbKQhY,2025-11-15,729120,915,1058572,0.69,2928.2,0.52
UF63eFJmbrQ,Practical Engineering,This Spillway Failed On Purpose,https://www.youtube.com/watch?v=UF63eFJmbrQ,2026-04-07,724554,1144,1058572,0.68,6835.4,1.21
3FfMzWa6LKg,Practical Engineering,An Engineer's Perspective on the Texas Floods,https://www.youtube.com/watch?v=3FfMzWa6LKg,2025-09-16,697225,1394,1058572,0.66,2256.4,0.40
qt2j2gn0yWc,Practical Engineering,How Earthquake Bearings Work,https://www.youtube.com/watch?v=qt2j2gn0yWc,2026-03-03,629660,1084,1058572,0.59,4465.7,0.79
DWLcmq_DiaA,Practical Engineering,Fixing the Most Dangerous Dam in the World,https://www.youtube.com/watch?v=DWLcmq_DiaA,2026-05-19,589458,1343,1058572,0.56,9210.3,1.64
7oi4yMr8Rjk,Practical Engineering,Bridge Demolition is Complicated,https://www.youtube.com/watch?v=7oi4yMr8Rjk,2026-06-16,486327,1076,1058572,0.46,13509.1,2.40
Iclf_JnPkKw,Practical Engineering,What's Under Your Feet in New York City?,https://www.youtube.com/watch?v=Iclf_JnPkKw,2026-07-21,274659,1352,1058572,0.26,274659.0,48.82
kUYzuAJeg3M,Primal Space,The Self Balancing Monorail,https://www.youtube.com/watch?v=kUYzuAJeg3M,2023-12-22,12093003,513,3017468,4.01,12824.0,1.58
77omYd0JOeA,Primal Space,The Crazy Engineering of Venice,https://www.youtube.com/watch?v=77omYd0JOeA,2024-07-30,11023306,568,3017468,3.65,15267.7,1.88
Xosn4ManeD4,Primal Space,The Robot Chess Player Scam,https://www.youtube.com/watch?v=Xosn4ManeD4,2024-06-26,8194954,595,3017468,2.72,10839.9,1.34
zouFjgkE_4Y,Primal Space,The Discovery of King Richard III,https://www.youtube.com/watch?v=zouFjgkE_4Y,2024-12-29,6950482,557,3017468,2.30,12193.8,1.50
xLaLpMeOyHk,Primal Space,The Ancient City That Mastered Water,https://www.youtube.com/watch?v=xLaLpMeOyHk,2024-11-28,6763022,549,3017468,2.24,11252.9,1.39
UeuA4QO7L3k,Primal Space,The Hidden Engineering of Gas Stations,https://www.youtube.com/watch?v=UeuA4QO7L3k,2025-05-31,5497305,516,3017468,1.82,13183.0,1.63
rMGUA77z80E,Primal Space,Surviving Venus in the 1970s,https://www.youtube.com/watch?v=rMGUA77z80E,2024-01-25,5258852,523,3017468,1.74,5785.3,0.71
B64DRD5vWXE,Primal Space,Killing Russia's Most Hated Man,https://www.youtube.com/watch?v=B64DRD5vWXE,2025-07-30,4880206,1032,3017468,1.62,13670.0,1.69
h0ZMhhquL8c,Primal Space,The Greatest Art Heist In History,https://www.youtube.com/watch?v=h0ZMhhquL8c,2025-02-27,4692143,566,3017468,1.55,9200.3,1.13
0h8vAGCiRX0,Primal Space,How IKEA Mastered Furniture,https://www.youtube.com/watch?v=0h8vAGCiRX0,2025-11-09,4459910,595,3017468,1.48,17489.8,2.16
Nb1PrONDHhk,Primal Space,How This Pen Changed The World,https://www.youtube.com/watch?v=Nb1PrONDHhk,2024-04-25,4098191,557,3017468,1.36,5010.0,0.62
kH0Yw0R84i0,Primal Space,The Hidden Engineering of Mount Rushmore,https://www.youtube.com/watch?v=kH0Yw0R84i0,2024-09-27,3752135,531,3017468,1.24,5659.3,0.70
hyjCmIbRRvs,Primal Space,Why Inventing Color TV Was So Difficult,https://www.youtube.com/watch?v=hyjCmIbRRvs,2026-03-31,3619469,905,3017468,1.20,32030.7,3.95
YyhzgNdSnbQ,Primal Space,The Greatest Double Agent Ever,https://www.youtube.com/watch?v=YyhzgNdSnbQ,2025-10-07,3556028,779,3017468,1.18,12347.3,1.52
BZkJH_rn7TI,Primal Space,The Most Wanted Shipwreck,https://www.youtube.com/watch?v=BZkJH_rn7TI,2025-04-04,3039036,631,3017468,1.01,6411.5,0.79
wyTOYEk_Z2Y,Primal Space,Why Ancient Ruins Are Underground,https://www.youtube.com/watch?v=wyTOYEk_Z2Y,2025-05-03,2995901,512,3017468,0.99,6732.4,0.83
_CPxe8yql0Q,Primal Space,Voyager's 15 Billion Mile Software Update,https://www.youtube.com/watch?v=_CPxe8yql0Q,2023-11-23,2753451,500,3017468,0.91,2832.8,0.35
v5mkZIy-TI4,Primal Space,Why This Building Makes So Much Money,https://www.youtube.com/watch?v=v5mkZIy-TI4,2025-08-31,2283065,717,3017468,0.76,7024.8,0.87
gol_p2aWrJg,Primal Space,The Underground Clocks of Paris,https://www.youtube.com/watch?v=gol_p2aWrJg,2024-02-25,2239784,511,3017468,0.74,2551.0,0.31
1pPoB8be1G0,Primal Space,How Investigators Find the Source of a Fire,https://www.youtube.com/watch?v=1pPoB8be1G0,2026-01-30,2155360,536,3017468,0.71,12458.7,1.54
TunR4zCQ5Fk,Primal Space,The Insane VFX of Old Movies,https://www.youtube.com/watch?v=TunR4zCQ5Fk,2025-12-11,2050389,685,3017468,0.68,9194.6,1.13
mzwwofB5_Nc,Primal Space,The Longest Solar Eclipse Ever,https://www.youtube.com/watch?v=mzwwofB5_Nc,2024-03-31,1948327,511,3017468,0.65,2311.2,0.28
